{
  "campaign_ulid": "01KRKJ5E76RYW4511E4S5S8VJ0",
  "campaign_code_anonymized": "OGZ-CAMPAIGN-026",
  "sector": "f_and_b",
  "year": 2025,
  "schema_version": 1,
  "occasion_context": "ramadan",
  "brief_summary_anonymized": "Beverage major — Ramadan packaging launch. Risk: blend into Ramadan-ad cliché.",
  "cd_brain_used": "cd_05",
  "cd_brain_used_secondary": "cd_03",
  "strategic_insight": "Don't avoid the Ramadan-ad cliché — embrace it as a commentary. The campaign performs the genre while subverting it.",
  "execution_summary": "Visually + tonally mimics Ramadan-ad sub-genre. Audience recognizes the format. Subtle pivot reveals the campaign is aware of what it's doing. Self-aware genre play.",
  "chains_used": [
    "tf22_04",
    "tf16_02"
  ],
  "outcomes": {
    "engagement_lift": "+62%"
  },
  "what_made_it_work": [
    "Self-aware genre-play signals confidence and earns audience smile",
    "Cultural commentary outperforms straight commercial content",
    "Targets audience that's saturated with sector clichés"
  ],
  "what_would_NOT_transplant": [
    "Requires audience saturated with the genre being parodied",
    "Easy to misread as disrespectful; restraint critical for religious-occasion content"
  ],
  "retrieval_keywords": [
    "beverage_ramadan",
    "paradox_hunter",
    "self_aware_genre",
    "cultural_commentary",
    "subverted_cliche"
  ],
  "provenance": {
    "source": "internal_research_corpus/ogz_campaign_archive.md#campaign_026",
    "date_added": "2026-05-14T15:37:27Z",
    "confirmer": "Mohamed",
    "confidence": "experimental",
    "scope": "sector:f_and_b"
  }
}
