{
  "campaign_ulid": "01KRKJ5E76RYW4511E4S5S8VJ1",
  "campaign_code_anonymized": "OGZ-CAMPAIGN-027",
  "sector": "f_and_b",
  "year": 2026,
  "schema_version": 1,
  "occasion_context": "brand_platform",
  "brief_summary_anonymized": "Beverage major — 2026 brand platform tied to 'That's My Life' tagline + AFC football partnership.",
  "cd_brain_used": "cd_03",
  "strategic_insight": "Today's youth are constantly pushed into things that don't reflect their real character. Performance-anxiety masks the real self.",
  "execution_summary": "Two-scene contrast: same place, same people — formal scene vs. real scene. The energy shifts when only the close ones remain. Product arrives at the moment of permission to be real.",
  "chains_used": [
    "tf04_04",
    "tf04_05",
    "tf22_04",
    "tf22_03"
  ],
  "outcomes": {
    "engagement_lift_projected": "+72%",
    "client_renewal": "pending"
  },
  "what_made_it_work": [
    "Performance-vs-reality two-scene contrast is signature emotional architecture",
    "Product as permission-to-be-real outperforms product-as-status",
    "AFC football integration: 'the game ends, the real stories begin'"
  ],
  "what_would_NOT_transplant": [
    "Two-scene structure requires patience — fails in short formats",
    "Authentic-self framing is wrong for premium / aspirational brands"
  ],
  "retrieval_keywords": [
    "beverage",
    "authenticity_detective",
    "two_scene_contrast",
    "performance_reality",
    "afc_football"
  ],
  "provenance": {
    "source": "internal_research_corpus/ogz_campaign_archive.md#campaign_027",
    "date_added": "2026-05-14T15:37:27Z",
    "confirmer": "Mohamed",
    "confidence": "experimental",
    "scope": "sector:f_and_b"
  }
}
