{
  "campaign_ulid": "01KRKJ5E77DXV7B935E1BF7CT7",
  "campaign_code_anonymized": "OGZ-CAMPAIGN-031",
  "sector": "telecom",
  "year": 2025,
  "schema_version": 1,
  "occasion_context": "b2b_segment",
  "brief_summary_anonymized": "Telecom — small business segment — needs B2B content that doesn't feel corporate-stiff.",
  "cd_brain_used": "cd_05",
  "strategic_insight": "Saudi small-business owners are entrepreneurs first, business-owners second. The brand speaks like an honest peer, not a corporate vendor.",
  "execution_summary": "Real small-business owner voices. Anti-corporate language. Practical-direct register. Specific Saudi business contexts (café, retail boutique, small services).",
  "chains_used": [
    "tf23_08",
    "tf23_02",
    "tf04_05"
  ],
  "outcomes": {
    "engagement_lift": "+44%"
  },
  "what_made_it_work": [
    "Peer-voice register outperforms corporate-vendor register for SME audience",
    "Specific Saudi business contexts signal cultural literacy",
    "Practical-direct (vs aspirational) suits the audience's daily reality"
  ],
  "what_would_NOT_transplant": [
    "Works for established peer-credibility brands; new entrants need different framing",
    "Wrong fit for enterprise B2B (different audience expectations)"
  ],
  "retrieval_keywords": [
    "telecom_b2b",
    "paradox_hunter",
    "peer_voice",
    "saudi_sme",
    "anti_corporate"
  ],
  "provenance": {
    "source": "internal_research_corpus/ogz_campaign_archive.md#campaign_031",
    "date_added": "2026-05-14T15:37:27Z",
    "confirmer": "Mohamed",
    "confidence": "experimental",
    "scope": "sector:telecom"
  }
}
