{
  "campaign_ulid": "01KRKJ5E76RYW4511E4S5S8VHT",
  "campaign_code_anonymized": "OGZ-CAMPAIGN-020",
  "sector": "beauty",
  "year": 2024,
  "schema_version": 1,
  "occasion_context": "product_launch",
  "brief_summary_anonymized": "Clean-beauty brand needs to launch in saturated category and avoid trend-of-the-month positioning.",
  "cd_brain_used": "cd_01",
  "cd_brain_used_secondary": "cd_03",
  "strategic_insight": "The brand's contrarian belief: results come from consistent ritual, not from miracle ingredients. The campaign earns trust through honest pacing, not promises.",
  "execution_summary": "Brief routine scenes — woman applying product as quiet daily moment. No 'transformation' framing. Voice: calm-reassuring, no hyperbole.",
  "chains_used": [
    "tf04_01",
    "tf04_03",
    "tf11_03",
    "tf22_03"
  ],
  "outcomes": {
    "engagement_lift": "+42%"
  },
  "what_made_it_work": [
    "Anti-hyperbole voice differentiates in over-promised category",
    "Daily-ritual framing reframes purchase as commitment, not novelty",
    "Calm pacing signals product confidence"
  ],
  "what_would_NOT_transplant": [
    "Wrong fit for impulse-buy / quick-trial categories",
    "Requires brand with willingness to play long-game vs spike-launch"
  ],
  "retrieval_keywords": [
    "clean_beauty",
    "firaasa_architect",
    "authenticity_detective",
    "anti_hyperbole",
    "daily_ritual"
  ],
  "provenance": {
    "source": "internal_research_corpus/ogz_campaign_archive.md#campaign_020",
    "date_added": "2026-05-14T15:37:27Z",
    "confirmer": "Mohamed",
    "confidence": "experimental",
    "scope": "sector:beauty"
  }
}
