{
  "campaign_ulid": "01KRKJ5E76RYW4511E4S5S8VHV",
  "campaign_code_anonymized": "OGZ-CAMPAIGN-021",
  "sector": "government",
  "year": 2025,
  "schema_version": 1,
  "occasion_context": "founding_day",
  "brief_summary_anonymized": "Aviation authority Founding Day — wants content beyond institutional achievement showcase.",
  "cd_brain_used": "cd_04",
  "cd_brain_used_secondary": "cd_05",
  "strategic_insight": "Aviation in Saudi has a foundation story too — from the first flights of the Kingdom to today's hub status. The campaign anchors modern aviation in heritage.",
  "execution_summary": "Archive-meets-modern visual structure. Historical archive footage cross-cut with contemporary aviation scenes. Classical-Arabic narration with confident close.",
  "chains_used": [
    "tf22_04",
    "tf23_10",
    "tf23_08"
  ],
  "outcomes": {
    "engagement_lift": "+34%"
  },
  "what_made_it_work": [
    "Sector-specific heritage angle (aviation history) avoids generic patriotism",
    "Archive footage authenticates the historical claim",
    "Pacing balances institutional dignity with audience engagement"
  ],
  "what_would_NOT_transplant": [
    "Requires actual archive material — fabricated history reads obvious",
    "Founding Day register; doesn't transplant to National Day or commercial occasions"
  ],
  "retrieval_keywords": [
    "aviation",
    "founding_day",
    "heritage_decoder",
    "archive_meets_modern",
    "sector_specific_heritage"
  ],
  "provenance": {
    "source": "internal_research_corpus/ogz_campaign_archive.md#campaign_021",
    "date_added": "2026-05-14T15:37:27Z",
    "confirmer": "Mohamed",
    "confidence": "experimental",
    "scope": "sector:government"
  }
}
